date,priority,headline,time_ago,link,title,address,clean_address,latlng,case,content
2018-11-16 03:33:00,Advisory,Community advisory ,"Entered: 8 months, 1 week ago",/alert/6932268/,Armed Robbery,2147 Parker St,"2147 Parker St, Berkeley, CA 94704, USA","(37.8625816, -122.2651006)",BPD Case #18-63994,"['City of Berkeley Police Department Jurisdiction', 'On November 15th at about 10:22 PM, an unknown affiliated person was the victim of a robbery via gun. The three male suspects stole the victim’s cell phone and fled northbound on foot Fulton St from Parker St.', 'If you have any information about this crime, please contact: ', 'City of Berkeley Police Department', '(510) 981-5900 / 24 Hours', 'UCPD would like to remind the campus community about the following safety tips:', 'Utilize the free Night Safety Services located at http://nightsafety.berkeley.edu', 'Travel with a friend or in a group', 'Be alert and aware of your surroundings', 'When out and about, keep your electronic devices out of public view as they are a popular robbery target', 'If a motor vehicle is involved in a crime report the following information: activity, direction of travel, license plate, color, make/model, unusual characteristics (e.g., dents, bumper stickers, graphics, wheels, tinted windows, lifted/lowered), number of persons, etc.', 'Thiscrimealerthas been released with the joint cooperation of BPD and UCPD. ', 'Clery Timely Warnings are released by the University California Police Department when certain crimes are reported on or near campus property, in compliance with federal law. These timely warnings provide information about campus safety situations, and allow campus community members to take precautions for personal safety. The reported information may not have been investigated or confirmed at the time the issuance of the warning.', '(Physical descriptions of a suspect, including race are included in timely warnings only when they provide several details that might help distinguish the suspect’s appearance from the general population.)']"
2018-11-16 03:29:00,Advisory,Community advisory ,"Entered: 8 months, 1 week ago",/alert/6932260/,Armed Robbery,2306 Dwight Way,"2306 Dwight Way, Berkeley, CA 94704, USA","(37.8643917, -122.2626194)",BPD Case #18-63997,"['City of Berkeley Police Department Jurisdiction', 'On November 15', 'th', ' at about 10:27 PM, an unknown affiliated person was the victim of a robbery via threat of a gun. The two male and two female suspects stole the victim’s cell phone and fled westbound on Dwight Way.', 'If you have any information about this crime, please contact: ', 'City of Berkeley Police Department', '(510) 981-5900 / 24 Hours', 'UCPD would like to remind the campus community about the following safety tips:', 'Utilize the free Night Safety Services located at http://nightsafety.berkeley.edu', 'Travel with a friend or in a group', 'Be alert and aware of your surroundings', 'When out and about, keep your electronic devices out of public view as they are a popular robbery target', 'If a motor vehicle is involved in a crime report the following information: activity, direction of travel, license plate, color, make/model, unusual characteristics (e.g., dents, bumper stickers, graphics, wheels, tinted windows, lifted/lowered), number of persons, etc.', 'Thiscrimealerthas been released with the joint cooperation of BPD and UCPD. ', 'Clery Timely Warnings are released by the University California Police Department when certain crimes are reported on or near campus property, in compliance with federal law. These timely warnings provide information about campus safety situations, and allow campus community members to take precautions for personal safety. The reported information may not have been investigated or confirmed at the time the issuance of the warning.', '(Physical descriptions of a suspect, including race are included in timely warnings only when they provide several details that might help distinguish the suspect’s appearance from the general population.)']"
2018-11-09 09:33:00,Advisory,Timely Warning - Mountain Lion Sighting ,"Entered: 8 months, 2 weeks ago",/alert/6915872/,False,False,"Berkeley, CA, USA","(37.8715226, -122.273042)",False,"['On Thursday, November 8, 2018 at approximately 6:32 PM, UCPD received a report of a mountain lion sighting at Lawrence Hall of Science (LHS) near the Lawrence Berkeley Lab (LBL) fence line. A couple was seated on a bench west of the Vista Lot of LHS whenthey spotted the mountain lion down the hill near the east fence line of LBL. The animal was on the LBL side of the fence. It looked toward the couple and walked away.', 'Deer are a major food source for mountain lions. In the past couple of years, several sightings of mountain lions have occurred in the hills above the Berkeley campus and carcasses of animals suspected to have been attacked by mountain lions were also discovered.', 'To reduce the chances of encountering a mountain lion:', 'Avoid hiking or jogging alone, especially between dusk and dawn, when lions normally do their hunting. Make plenty of noise while you hike so as to reduce the chances of surprising a lion.', ""Always keep children and pets in sight while hiking and within arm's reach in areas that can conceal a lion."", 'Hike with a good walking stick; this can be useful in warding off a lion.', 'To reduce the chances of an attack when encountering a mountain lion:', 'Do not approach a lion, especially if it is feeding or with its young. Most lions will avoid confrontation. Give them a way to escape.', 'If you encounter a mountain lion, do not run; instead, face the animal, make noise and try to look bigger by waving your arms; throw rocks or other objects. Pick up small children.', 'Fight back if attacked. Since a mountain lion usually tries to bite the head or neck, try to remain standing and face the attacking animal. People have successfully fought back with rocks, sticks, or bare hands.', 'If a mountain lion attacks a person, immediately call 911.']"
2018-11-02 12:54:00,Advisory,Timely Warning ,"Entered: 8 months, 3 weeks ago",/alert/6902308/,Strong-Arm Robbery,Durant Avenue at Bowditch Street,"Bowditch St & Durant Ave, Berkeley, CA 94704, USA","(37.868105, -122.2567088)",BPD Case # 18-61501,"['City of Berkeley Police Department Jurisdiction', 'On 11/2/18 at about 4:10 AM, a UC student was the victim of a strong-arm robbery near the intersection of Durant Avenue and Bowditch Street. Two male suspects stole the victim’s iPhone 7 and fled the area.', 'If you have any information about these crimes, please contact:', 'City of Berkeley Police Department', '(510) 981-5900 / 24 Hours', 'UCPD would like to remind the campus community about the following safety tips:', 'Utilize the free Night Safety Services located at ', 'http://nightsafety.berkeley.edu', 'Travel with a friend or in a group', 'Be alert and aware of your surroundings', 'When out and about, keep your electronic devices out of public view as they are a popular robbery target', 'Dial 510-642-3333 or use a Blue Light emergency phone if you need help.', 'Thiscrimealerthas been released with the joi', 'nt cooperation of BPD and UCPD. ', 'Clery Timely Warnings are released by the University California Police Department when certain crimes are reported on or near campus property, in compliance with federal law. These timely warnings provide information about campus safety situations, and allow campus community members to take precautions for personal safety. The reported information may not have been investigated or confirmed at the time the issuance of the warning.', '(Physical descriptions of a suspect, including race are included in timely warnings only when they provide several details that might help distinguish the suspect’s appearance from the general population.)']"
2018-11-01 02:08:00,Advisory,Timely Warning ,"Entered: 8 months, 3 weeks ago",/alert/6900226/,Burglary, 18-02945 and #18-02948,"Berkeley, CA, USA","(37.8715226, -122.273042)",UCPD Case #,"['Energy Bio-Science Building (EBB) 2151 Berkeley Way West and Berkeley Way West Building 2121 Berkeley Way West', 'On October 31', 'st', ' 2018, between approximately 11:16am and 12:16pm there was a series of laptops stolen from two buildings located on University of California property (Energy Bio-Science building and Berkeley Way West building). No UC Berkeley affiliates were injured during the process of the burglaries. All laptops have since been recovered.', 'The pictured suspects are responsible for the burglaries. This is on ongoing investigation, if you can identify the suspects please contact the UC Berkeley Police Department.', 'If you have any information about this crime, or if you know about any recent similar incidents please contact:', 'University of California Police Department', 'Criminal Investigation Bureau', '(510) 642-0472', ' / 8AM–5PM / during business hours, except holidays', '(510) 642-6760', ' / All other times', 'UCPD would like to remind the campus community about the following safety tips:', 'Report any suspicious persons or behaviors to UCPD immediately. The following are examples of behaviors that could be considered suspicious:\t', 'A person or persons you, or the other employees, do not recognize going from office to office', 'A person or persons standing in a hallway for a long period of time', 'A person or persons waiting outside of the building near the time that the building will be closing', 'Familiarize your employees with your security systems and procedures.', 'Keep a record of all keys issued. Master keys and extra duplicates should be locked away for safekeeping.', 'Maintain an inventory of all office equipment; include the make, model and serial number of each item. Keep this inventory in a safe place. Keep it current by adding the identification numbers of all new equipment.', 'Please do not delay in calling 911. UCPD strongly encourages the reporting of criminal or suspicious activity in a timely manner to assist us in intervening in potential criminal actively and apprehending suspects.', 'Clery Timely Warnings are released by the University California Police Department when certain crimes are reported on or near campus property, in compliance with federal law. These timely warnings provide information about campus safety situations, and allow campus community members to take precautions for personal safety. The reported information may not have been investigated or confirmed at the time the issuance of the warning.', '(Physical descriptions of a suspect, including race are included in timely warnings only when they provide several details that might help distinguish the suspect’s appearance from the general population.']"
2018-10-30 01:36:00,Advisory,Timely Warning ,"Entered: 8 months, 3 weeks ago",/alert/6895792/,COMMUNITY ADVISORY,False,"Berkeley, CA, USA","(37.8715226, -122.273042)",False,"['You may be aware of the recent arrest in Florida of a suspect accused of mailing explosives to prominent elected officials and others. Additional investigation by the Federal Bureau of Investigation indicates the term “UC Berkeley Library” was used in an Internet search by the suspect.', 'There is no specific reason to believe any explosives have been sent to the University, but UCPD asks the community to stay vigilant and report any suspicious packages without delay. No specific persons affiliated with the University have been identified as possible recipients and the “library” was the only identified location.', 'UCPD recognized and prepared for this possibility when the incidents first gained national attention. Our explosive detection K-9s continue to make routine checks of incoming mail and the UCPD Bomb Squad is well prepared to respond if needed. We are making extra checks of library facilities to ensure public safety.', 'For guidance on how to identify suspicious packages, please review the following information provided by the FBI:', 'https://www.fbi.gov/file-repository/suspicious-package-indicators.pdf', 'To report any suspicious packages discovered on campus or other related concerns, please contact UCPD:', '510-642-6760 (24-hr, non-emergency)', 'IN AN EMERGENCY OR TO REPORT AN IN-PROGRESS CRIME,', 'DIAL 911', 'For additional information or questions, please contact the UCPD Criminal Investigations Bureau / Threat Management Unit at (510) 642-0472 or police@berkeley.edu.']"
2018-10-25 11:57:00,Advisory,community advisory  ,"Entered: 8 months, 4 weeks ago",/alert/6886466/,Armed Robbery,Shattuck Ave,"Shattuck Ave, Berkeley, CA, USA","(37.8637766, -122.2674013)",UCPD Case #18-02871,"['City of Berkeley Police Department Jurisdiction', 'On October 24', 'th', ', 2018 at 9am the victim was located on Shattuck Ave in the city of Berkeley. The exact location on Shattuck Ave is unknown. The victim reported a suspect pointed a black hand gun at him and took money out of his pocket. The victim reported the suspect shot the gun into the air while fleeing the scene. The victim is not a UC Berkeley student and was not injured during the incident.', 'If you have any information about this crime, please contact: ', 'City of Berkeley Police Department', '(510) 981-5900 / 24 Hours', 'UCPD would like to remind the campus community about the following safety tips:', 'Utilize the free Night Safety Services located at http://nightsafety.berkeley.edu', 'Travel with a friend or in a group', 'Be alert and aware of your surroundings', 'When out and about, keep your electronic devices out of public view as they are a popular robbery target', 'If a motor vehicle is involved in a crime report the following information: activity, direction of travel, license plate, color, make/model, unusual characteristics (e.g., dents, bumper stickers, graphics, wheels, tinted windows, lifted/lowered), number of persons, etc.', 'Thiscrimealerthas been released with the joint cooperation of BPD and UCPD. ', 'Clery Timely Warnings are released by the University California Police Department when certain crimes are reported on or near campus property, in compliance with federal law. These timely warnings provide information about campus safety situations, and allow campus community members to take precautions for personal safety. The reported information may not have been investigated or confirmed at the time the issuance of the warning.', '(Physical descriptions of a suspect, including race are included in timely warnings only when they provide several details that might help distinguish the suspect’s appearance from the general population.)']"
2018-10-15 12:14:00,Advisory,Timely Warning ,"Entered: 9 months, 1 week ago",/alert/6867454/,Strong Arm Robbery,Southwest corner People’s Park,"People's Park, 2556 Haste St, Berkeley, CA 94704, USA","(37.8658134, -122.2570583)",UCPD Case # 18-02760,"['On 10-14-2018 at approximately 2140 hours, the victim was in Southwest People’s Park when she opened her purse to show some of her property. A female suspect walked up to the victim, punched her once in the face, then stole the victim’s purse. The female suspect fled north through the park. UCPD and BPD officers searched the area with negative results.', ' Suspect #1: Female, approximately 25-30 years old', 'If you have any information about this crime, please contact:', 'University of California Police Department', 'Criminal Investigation Bureau', '(510) 642-0472 / 8AM–5PM / during business hours, except holidays', '(510) 642-6760 / All other times', 'UCPD would like to remind the campus community about the following safety tips:', 'Utilize the free Night Safety Services located at ', 'http://nightsafety.berkeley.edu', 'Travel with a friend or in a group', 'Be alert and aware of your surroundings', 'When out and about, keep your electronic devices out of public view as they are a popular robbery target', 'If you need help dial 911 or use a Blue Light emergency phone (located throughout the campus and identified by a blue light on top of the phone box or column).', 'Please do not delay in calling law enforcement. UCPD strongly encourages the reporting of criminal or suspicious activity in a timely manner to assist us in intervening in potential criminal actively and apprehending suspects.', 'Clery Timely Warnings are released by the University California Police Department when certain crimes are reported on or near campus property, in compliance with federal law. These timely warnings provide information about campus safety situations, and allow campus community members to take precautions for personal safety. The reported information may not have been investigated or confirmed at the time the issuance of the warning.', '(Physical descriptions of a suspect, including race are included in timely warnings only when they provide several details that might help distinguish the suspect’s appearance from the general population.)']"
2018-10-09 11:54:00,Advisory,Timely warning ,"Entered: 9 months, 2 weeks ago",/alert/6854942/,Sexual Assault,University Housing,"1040 University Ave, Berkeley, CA 94710, USA","(37.8686769, -122.2935344)",UCPD Case #18-02645,"['On October 5', 'th', ' at about 4:00am a sexual assault occurred inside of University Housing. The sexual assault was reported to UCPD through mandatory reporting. The survivor is a UC Berkeley student. No suspect information.', 'If you have any information about this crime, or if you know about any recent similar incidents please contact:', 'University of California Police Department', 'Criminal Investigation Bureau', '(510) 642-0472', ' / 8AM–5PM / during business hours, except holidays', '(510) 642-6760', ' / All other times', 'UCPD would like to remind the campus community about the following safety tips:', 'Rape and sexual assault are never the fault of the survivor. It is the behavior of the perpetrator that is wrong.', '80% of sexual assault and rapes are perpetrated by someone known to the survivor, and on college campuses 90% of survivors know their attacker.', 'Sexual assault and rape can happen to people in all contexts, including marriage, dating relationships, friendships, child-parent interactions, employer-attendant relationships and stranger interactions.', 'If you are the victim of a sexual assault and wish to file a police report do not shower or wash your clothing worn during the assault.', 'If you have been the victim of a violent crime the following resources are available to', 'you:', 'Office for the Prevention of Harassment and Discrimination (Title IX) – (510) 643-7985', 'PATH to Care Center - Confidential Care Advocate - (510) 643-2005', 'Tang Social Services (510) 642-6074', 'Bay Area Women Against Rape (BAWAR) - 24-hr line (510) 845-RAPE (7273)', 'The Survivor Support Website - http://survivorsupport.berkeley.edu/', 'Gender Equity Resource Center - (510) 643-5727', 'Employee Assistance – (510) - 643-7754', 'ASUC Student Advocate’s Office- (510) 642-6912', 'Clery Timely Warnings are released by the University California Police Department when certain crimes are reported on or near campus property, in compliance with federal law. These timely warnings provide information about campus safety situations, and allow campus community members to take precautions for personal safety. The reported information may not have been investigated or confirmed at the time the issuance of the warning.', '(Physical descriptions of a suspect, including race are included in timely warnings only when they provide several details that might help distinguish the suspect’s appearance from the general population.)']"
2018-10-05 01:11:00,Advisory,Community Advisory ,"Entered: 9 months, 2 weeks ago",/alert/6848022/,Strong-Arm Robbery,"2200 Block of Channing Way, Berkeley","2200 Channing Way, Berkeley, CA 94704, USA","(37.8660217, -122.265432)",BPD Case # 18-56011,"['City of Berkeley Police Department Jurisdiction', 'On October 4', 'th', ' 2018 at about 9:43pm there was a strong-arm robbery of a cell phone that occurred on the 2200 Block of Channing Way in the city of Berkeley. The victim was a male UC Berkeley student. UC Berkeley and City of Berkeley Police Officers arrived on scene and arrested a female juvenile suspect. There was a male suspect who was not located. The victim was not injured during the robbery.', 'If you have any information about this crime, please contact: ', 'City of Berkeley Police Department', '(510) 981-5900 / 24 Hours', 'UCPD would like to remind the campus community about the following safety tips:', 'Utilize the free Night Safety Services located at http://nightsafety.berkeley.edu', 'Travel with a friend or in a group', 'Be alert and aware of your surroundings', 'When out and about, keep your electronic devices out of public view as they are a popular robbery target', 'If a motor vehicle is involved in a crime, report the following information: activity, direction of travel, license plate, color, make/model, unusual characteristics (e.g., dents, bumper stickers, graphics, wheels, tinted windows, lifted/lowered), number of persons, etc.', 'Thiscrimealerthas been released with the joint cooperation of BPD and UCPD. ', 'Clery Timely Warnings are released by the University California Police Department when certain crimes are reported on or near campus property, in compliance with federal law. These timely warnings provide information about campus safety situations, and allow campus community members to take precautions for personal safety. The reported information may not have been investigated or confirmed at the time the issuance of the warning.', '(Physical descriptions of a suspect, including race are included in timely warnings only when they provide several details that might help distinguish the suspect’s appearance from the general population.)']"
2018-09-22 07:09:00,Advisory,Timely Warning ,Entered: 10 months ago,/alert/6821532/,Strong Arm Robbery,"University Drive, west of Wickson Bridge","Berkeley, CA, USA","(37.8718992, -122.2585399)",UCPD Case #18-02481,"['The victim was walking on a pathway west of Moffitt Library towards the Wickson Bridge. The victim was looking at and manipulating her Apple Iphone X cell phone. The suspect came up behind the victim and snatched the cell phone right out of her hand and ran W/B on U Drive then N/B between Hilgard & Wellman towards Hearst Ave. A witness chased after the suspect and eventually caught up to him and was able to retrieve the cell phone and returned it to the victim. The victim was not hurt during the incident. The suspect was last seen westbound on Hearst Avenue from the north side of Tolman Hall area.Officers searched the area with negative results.', 'If you have any information about this crime, please contact:', 'University of California Police Department', 'Criminal Investigation Bureau', '(510) 642-0472 / 8AM–5PM', '(510) 642-6760 / All other times', 'UCPD would like to remind the campus community about the following safety tips: ', 'Utilize the free Night Safety Services located at http://nightsafety.berkeley.edu', 'Travel with a friend or in a group', 'Be alert and aware of your surroundings', 'When out and about, keep your electronic devices out of public view as they are a popular robbery target', 'If you need help, dial 510-642-3333 on your cell or use a Blue Light emergency phone (located throughout the campus and identified by a blue light on top of the phone box or column)', 'If a motor vehicle is involved in a crime report the following information: activity, direction of travel, license plate, color, make/model, unusual characteristics (e.g., dents, bumper stickers, graphics, wheels, tinted windows, lifted/lowered), number of persons, etc.', 'In this case a report was made to a Campus Security Authority who is required under the Federal Clery Act to report it to the campus Clery Compliance Officer. UCPD is in turn required to alert our community of the crime. The reported information may not have been investigated or confirmed at the time the issuance of the warning.', '(Physical descriptions of a suspect, including race are included in timely warnings only when they provide several details that might help distinguish the suspect’s appearance from the general population.)']"
